{
  "phase": {
    "number": 5,
    "title": "Observability & Monitoring",
    "focus": "Metrics, Logging, and Distributed Tracing",
    "narrative_overview": "This phase transforms the PCF API into a fully observable system by implementing comprehensive metrics collection, structured logging, and distributed tracing. The focus is on providing deep insights into system behavior while maintaining strict security boundaries and minimal performance impact. Every component will emit telemetry data that enables proactive monitoring, rapid debugging, and data-driven optimization.",
    "critical_requirements": [
      "No sensitive data (PII, passwords, tokens) in any telemetry output",
      "Cardinality limits enforced to prevent metric explosion",
      "Performance overhead must remain below 5% in production workloads",
      "All telemetry data must include trace context for correlation"
    ]
  },
  "prerequisites": {
    "intro_narrative": "Before implementing observability, ensure the foundation is solid and ready for instrumentation:",
    "completed_phases": {
      "required": "1-4",
      "descriptions": "Server foundation with health checks, database layer with connection pooling, GraphQL API with resolvers, and authorization with SpiceDB integration"
    },
    "knowledge_areas": [
      {
        "area": "Metrics and Time Series Data",
        "description": "Understanding of Prometheus metrics types (counters, gauges, histograms), cardinality implications, and aggregation patterns",
        "importance": "Essential"
      },
      {
        "area": "Distributed Tracing Concepts",
        "description": "Familiarity with spans, trace context propagation, sampling strategies, and OpenTelemetry standards",
        "importance": "Essential"
      },
      {
        "area": "Structured Logging",
        "description": "Experience with JSON logging, log levels, contextual fields, and security considerations for log data",
        "importance": "Essential"
      },
      {
        "area": "Performance Profiling",
        "description": "Basic understanding of profiling tools, overhead measurement, and optimization techniques",
        "importance": "Recommended"
      }
    ]
  },
  "resources": {
    "intro_narrative": "All resources are organized to support both implementation and learning:",
    "example_files": [
      {
        "name": "tdd-test-structure.rs",
        "path": "../../.spec/examples/tdd-test-structure.rs",
        "description": "Comprehensive test examples following TDD methodology",
        "purpose": "Provides the testing patterns that should be followed throughout this phase"
      },
      {
        "name": "metrics-patterns.rs",
        "path": "../../.spec/examples/metrics-patterns.rs",
        "description": "Prometheus metrics implementation patterns with cardinality control",
        "purpose": "Shows proper metric design to avoid cardinality explosion"
      },
      {
        "name": "tracing-patterns.rs",
        "path": "../../.spec/examples/tracing-patterns.rs",
        "description": "OpenTelemetry tracing examples with context propagation",
        "purpose": "Demonstrates span creation and trace context management"
      },
      {
        "name": "log-sanitization.rs",
        "path": "../../.spec/examples/log-sanitization.rs",
        "description": "Security-focused log sanitization patterns",
        "purpose": "Critical for preventing sensitive data leakage in logs"
      }
    ],
    "specifications": [
      {
        "name": "metrics.md",
        "path": "../../.spec/metrics.md",
        "description": "Complete metrics specification with cardinality guidelines",
        "key_sections": ["Metric Types", "Naming Conventions", "Cardinality Limits", "Dashboard Requirements"]
      },
      {
        "name": "logging.md",
        "path": "../../.spec/logging.md",
        "description": "Logging standards and sanitization requirements",
        "key_sections": ["Log Levels", "Structured Format", "Security Rules", "Retention Policies"]
      },
      {
        "name": "tracing.md",
        "path": "../../.spec/tracing.md",
        "description": "Distributed tracing requirements and patterns",
        "key_sections": ["Span Attributes", "Sampling Configuration", "Context Propagation", "Performance Budgets"]
      }
    ],
    "junior_dev_guides": [
      {
        "name": "Observability Tutorial",
        "path": "../../junior-dev-helper/observability-tutorial.md",
        "description": "Introduction to the three pillars of observability",
        "when_to_read": "Before starting any implementation"
      },
      {
        "name": "Prometheus Metrics Guide",
        "path": "../../junior-dev-helper/prometheus-metrics-guide.md",
        "description": "Deep dive into metric types, labels, and best practices",
        "when_to_read": "Before implementing Section 5.1"
      },
      {
        "name": "Cardinality Control Guide",
        "path": "../../junior-dev-helper/cardinality-control-guide.md",
        "description": "Critical guide on preventing metric explosion",
        "when_to_read": "Before adding ANY metric labels"
      },
      {
        "name": "Structured Logging Guide",
        "path": "../../junior-dev-helper/structured-logging-guide.md",
        "description": "JSON logging patterns and security considerations",
        "when_to_read": "Before implementing Section 5.2"
      },
      {
        "name": "OpenTelemetry Tracing Guide",
        "path": "../../junior-dev-helper/opentelemetry-tracing-guide.md",
        "description": "Distributed tracing concepts and implementation",
        "when_to_read": "Before implementing Section 5.3"
      },
      {
        "name": "Common Observability Errors",
        "path": "../../junior-dev-helper/observability-common-errors.md",
        "description": "Troubleshooting guide for metrics, logs, and traces",
        "when_to_read": "When encountering issues"
      }
    ],
    "quick_links": [
      {
        "name": "Verification Script",
        "command": "scripts/verify-phase-5.sh",
        "purpose": "Validates all observability components are working"
      },
      {
        "name": "Metrics Dashboard",
        "command": "just metrics-up && just grafana-up",
        "purpose": "Starts local Prometheus and Grafana for testing"
      },
      {
        "name": "Trace Viewer",
        "command": "just jaeger-up",
        "purpose": "Starts Jaeger UI for viewing distributed traces"
      }
    ]
  },
  "overview": {
    "narrative": "This work plan implements comprehensive observability across the PCF API in four carefully sequenced checkpoints. Each checkpoint builds upon the previous one, starting with metrics collection, then structured logging, followed by distributed tracing, and concluding with dashboard creation and performance validation. The plan emphasizes security (no sensitive data in telemetry), reliability (cardinality control), and performance (minimal overhead).",
    "checkpoint_summary": "Four checkpoints divide the work at natural boundaries: after metrics setup, after logging implementation, after tracing integration, and after dashboard/alerting setup. Each checkpoint includes specific verification steps and deliverables.",
    "time_estimate": "3-4 weeks for an experienced developer, 5-6 weeks for someone new to observability. Add 1 week if creating custom dashboards or complex alerting rules."
  },
  "build_commands": {
    "tool": "just",
    "intro_narrative": "This project uses `just` as the command runner to ensure consistency across environments. All commands include proper configuration and dependencies:",
    "commands": [
      {
        "command": "test",
        "description": "Run all tests including observability-specific test suites",
        "when_to_use": "After any code changes to verify nothing is broken"
      },
      {
        "command": "test-metrics",
        "description": "Run only metrics-related tests",
        "when_to_use": "When working on Section 5.1"
      },
      {
        "command": "test-logging",
        "description": "Run only logging-related tests",
        "when_to_use": "When working on Section 5.2"
      },
      {
        "command": "test-tracing",
        "description": "Run only tracing-related tests",
        "when_to_use": "When working on Section 5.3"
      },
      {
        "command": "metrics-up",
        "description": "Start local Prometheus with pre-configured scraping",
        "when_to_use": "To verify metrics are being collected correctly"
      },
      {
        "command": "grafana-up",
        "description": "Start Grafana with provisioned dashboards",
        "when_to_use": "To visualize metrics and test dashboards"
      },
      {
        "command": "jaeger-up",
        "description": "Start Jaeger for trace visualization",
        "when_to_use": "To verify distributed tracing is working"
      }
    ]
  },
  "review_process": {
    "importance_narrative": "This plan includes 4 mandatory review checkpoints where work MUST stop for external review. These checkpoints prevent cascading issues and ensure each observability layer is properly implemented before building the next. Observability code is particularly prone to production issues (cardinality explosion, performance degradation) if not reviewed carefully.",
    "checkpoint_count": 4,
    "review_timeout_hours": 24,
    "checkpoint_procedure": {
      "stop_instructions": "STOP all work and commit your code with a descriptive message",
      "review_preparation": [
        "Run all tests for the completed section",
        "Verify deliverables match the checkpoint requirements",
        "Document any deviations or blockers encountered",
        "Prepare specific questions if you need clarification",
        "Create checkpoint documentation in .claude/.reviews/"
      ],